"homograph"	"wordid"	"sentence"	"start"	"end"
"graduate"	"graduate_adj-nou"	"He enrolled in the English graduate program at Duke University, but never completed his Master's degree."	27	35
"graduate"	"graduate_adj-nou"	"North is a 2003 graduate of Indiana University and currently resides in Manhattan Beach, California."	16	24
"graduate"	"graduate_adj-nou"	"The university, with its 1903 teaching staff, offers courses to over 40,000 undergraduate, post graduate and doctorate students."	96	104
"graduate"	"graduate_adj-nou"	"She is a graduate of the London School of Journalism."	9	17
"graduate"	"graduate_adj-nou"	"She is a graduate of the University of Southern California."	9	17
"graduate"	"graduate_adj-nou"	"Doug McIntyre is a graduate of Stonehill College."	19	27
"graduate"	"graduate_adj-nou"	"The spokesperson (later spokespeople) were also selected by collaboration-wide vote, including graduate students."	95	103
"graduate"	"graduate_adj-nou"	"He is a post graduate in LL.M., and M.C.J (Journalism) from Osmania University."	13	21
"graduate"	"graduate_adj-nou"	"Molloy's student body numbers around 4,900 undergraduate, graduate and doctoral students."	58	66
"graduate"	"graduate_adj-nou"	"The Officers Training Academy on the other hand provides a 49-week course to Graduate officer candidates."	77	85
"graduate"	"graduate_adj-nou"	"He is a graduate of St.Joseph's College in Nainital."	8	16
"graduate"	"graduate_adj-nou"	"Graduate programs require 12 and 14 as passing grades for Master's and Ph.D. level programs, respectively."	0	8
"graduate"	"graduate_adj-nou"	"Templeton was a graduate of the University of Ulster at Jordanstown (B.A.), Queen's University of Belfast, (M.Th."	16	24
"graduate"	"graduate_adj-nou"	"In 1979, the School of Professional Psychology was established at Ferkauf Graduate School."	74	82
"graduate"	"graduate_vrb"	"At the time, he was just the second graduate of Central High School to graduate from a service academy."	71	79
"graduate"	"graduate_adj-nou"	"He was a graduate of Paris University Medical School."	9	17
"graduate"	"graduate_adj-nou"	"It has about 1,100 students enrolled in its undergraduate and graduate programs."	62	70
"graduate"	"graduate_adj-nou"	"Norton is a graduate of the Universities of Miami and Chicago."	12	20
"graduate"	"graduate_adj-nou"	"As President of the Economic Society, he joined in 1903 for the establishment of a Graduate School of Berlin."	83	91
"graduate"	"graduate_adj-nou"	"Within 10 years, 83% of Pomona graduates attend graduate and/or professional school."	48	56
"graduate"	"graduate_adj-nou"	"In 1961, he graduated from Stanford Graduate School of Business with an MBA."	36	44
"graduate"	"graduate_adj-nou"	"Assistantships provide much needed experience for graduate students, increasing their future employment options."	50	58
"graduate"	"graduate_adj-nou"	"King's room was photographed by production staff after a visit by Blatty, a Georgetown graduate, and Friedkin."	87	95
"graduate"	"graduate_adj-nou"	"Besides this, he pursued graduate courses in law and mathematics in Bucharest."	25	33
"graduate"	"graduate_adj-nou"	"His father was a member of a well-known family in County Limerick, and was a graduate of Trinity College, Dublin."	77	85
"graduate"	"graduate_adj-nou"	"Chapin stayed on at the Met for four years, subsequently becoming Dean of Columbia University's Graduate School of the Arts."	96	104
"graduate"	"graduate_adj-nou"	"Professor (John) Michael Clarke is a graduate of St Chad's College, Durham University."	37	45
"graduate"	"graduate_adj-nou"	"She is a graduate of New Trier High School and the University of Kansas."	9	17
"graduate"	"graduate_adj-nou"	"He received his Ph.D. degree in Political Science from the University of Santo Tomas Graduate School in Manila."	85	93
"graduate"	"graduate_vrb"	"Some policy study experts graduate from public policy schools with public policy degrees."	26	34
"graduate"	"graduate_adj-nou"	"Ellis, born in Spartanburg, South Carolina, is a 1969 graduate of the U.S. Naval Academy."	54	62
"graduate"	"graduate_adj-nou"	"She did graduate work at Indiana University, where she earned her Ph.D. in English in 1969."	8	16
"graduate"	"graduate_adj-nou"	"Grandhi Venkata Reddy Naidu received his graduate B.A., and law L.L.B., degrees from University of Madras."	41	49
"graduate"	"graduate_adj-nou"	"Jason is also a graduate of the National Outdoor Leadership School."	16	24
"graduate"	"graduate_adj-nou"	"Former Louisiana Secretary of State Al Ater was a graduate of the founding class."	50	58
"graduate"	"graduate_adj-nou"	"Vaidas Sakalauskas is a graduate of the Faculty of History of the Vilnius Pedagogical University in 1994."	24	32
"graduate"	"graduate_adj-nou"	"The graduate health course attracted considerable media attention, despite enrolling only three students."	4	12
"graduate"	"graduate_adj-nou"	"Here, Evans was tasked with improving the department, including the initiation of a graduate program."	84	92
"graduate"	"graduate_adj-nou"	"He graduated in 1984 and went on to graduate school at Berkeley, receiving his Ph.D. in 1989."	36	44
"graduate"	"graduate_adj-nou"	"The graduate-entry school is located at the Royal Derby Hospital."	4	12
"graduate"	"graduate_adj-nou"	"Upon graduation he was named graduate of the decade and ranked among the top 40 graduates in 40 years."	29	37
"graduate"	"graduate_adj-nou"	"O'Meara is a graduate of American University."	13	21
"graduate"	"graduate_adj-nou"	"Praveena is an English literature graduate from the University of Madras."	34	42
"graduate"	"graduate_adj-nou"	"His sister is a graduate of Boston College."	16	24
"graduate"	"graduate_adj-nou"	"He is a graduate of the United States Military Academy."	8	16
"graduate"	"graduate_adj-nou"	"She then completed her graduate studies at the New York University Institute of Fine Arts in 1970."	23	31
"graduate"	"graduate_adj-nou"	"In 1988, he went to Penn State, where he would work for the next 23 years, as a graduate assistant."	80	88
"graduate"	"graduate_adj-nou"	"Graphmatica is a graphing program created by Keith Hertzer, a graduate of the University of California, Berkeley."	62	70
"graduate"	"graduate_adj-nou"	"She is a graduate in fashion designing."	9	17
"graduate"	"graduate_adj-nou"	"In 1949, he obtained a Master of Arts from Claremont Graduate University, also in California."	53	61
"graduate"	"graduate_adj-nou"	"As a graduate student, he began a cello program for the Opus 118 Music Center in East Harlem."	5	13
"graduate"	"graduate_adj-nou"	"The school has 88 doctoral students and 279 graduate students."	44	52
"graduate"	"graduate_adj-nou"	"Post Graduate Diploma in Event Management (PGDEM)The institute also provide course on wedding management, sports management."	5	13
"graduate"	"graduate_adj-nou"	"The institute offers several post graduate diplomas also."	34	42
"graduate"	"graduate_adj-nou"	"Johnson is a 2008 graduate of Orange High School in Orange, California and was coached by Pete Tavoularis."	18	26
"graduate"	"graduate_adj-nou"	"She is a post graduate in Biochemistry and did her Bachelor's degree in Law."	14	22
"graduate"	"graduate_adj-nou"	"Another Boys High graduate remembered that ""I went to Boys High School in Brooklyn, a great school."	18	26
"graduate"	"graduate_adj-nou"	"He attended Princeton University as an undergraduate and remained there for graduate work, receiving his Ph.D. in 1937."	76	84
"graduate"	"graduate_adj-nou"	"Graduate students can earn a master of science or doctoral degree."	0	8
"graduate"	"graduate_adj-nou"	"Harding of Memphis Graduate School Bulletin 13.8 (Nov. 1974): 4."	19	27
"graduate"	"graduate_adj-nou"	"Wojciech is a graduate of history of John Paul II Catholic University of Lublin."	14	22
"graduate"	"graduate_adj-nou"	"Snyder (born 23 November 1958) is a Civil Engineering graduate from the University of Waterloo."	54	62
"graduate"	"graduate_adj-nou"	"During this period he also wrote his Ph.D. thesis (completed in 1949), despite having never taken any graduate math courses."	102	110
"graduate"	"graduate_vrb"	"To graduate with an associate degree, students must earn 63 credit hours in select fields mandated by Navarro College."	3	11
"graduate"	"graduate_adj-nou"	"The tuition varies depending on undergraduate (lower and upper level division) and graduate students."	83	91
"graduate"	"graduate_adj-nou"	"She is a graduate of the Italia Conti Academy of Theatre Arts stage school."	9	17
"graduate"	"graduate_adj-nou"	"In Reichenbach, it was John Hagnus, a graduate of the University of Wittenberg, the Protestant Church to enforce order."	38	46
"graduate"	"graduate_adj-nou"	"By the time aerial activity over the North resumed, most Navy squadrons had a Topgun graduate."	85	93
"graduate"	"graduate_adj-nou"	"His areas of interests are advanced Architectural Design, architectural theory, and graduate design."	84	92
"graduate"	"graduate_adj-nou"	"As an engineering graduate, Sharer served in the navy from 1971 through 1978."	18	26
"graduate"	"graduate_adj-nou"	"Haight graduated as a lawyer from Yale Graduate in 1892."	39	47
"graduate"	"graduate_adj-nou"	"She began her graduate studies in 1974 at the University of Colorado at Boulder."	14	22
"graduate"	"graduate_adj-nou"	"She did graduate work on strategic and international studies at Oxford University."	8	16
"graduate"	"graduate_adj-nou"	"In 2003, he was made an honorary graduate of the University of Essex."	33	41
"graduate"	"graduate_adj-nou"	"He served as a graduate assistant coach there, where he coached wide receivers and defensive backs."	15	23
"graduate"	"graduate_adj-nou"	"Lastly Colchester House located on the Brookline campus, houses 25 graduate and undergraduate upperclassman students."	67	75
"graduate"	"graduate_adj-nou"	"During this series, she is a New York University graduate student in art history, specializing in Medieval European art."	49	57
"graduate"	"graduate_adj-nou"	"She did her Graduate work at Adelphi University and Queens College."	12	20
"graduate"	"graduate_adj-nou"	"He studied law in the graduate studies at the Law Faculty of Vilnius University."	22	30
"graduate"	"graduate_adj-nou"	"An Annapolis graduate and expert marksman, Captain Tomb had a distinguished naval career."	13	21
"graduate"	"graduate_adj-nou"	"He studied civil engineering at graduate level."	32	40
"graduate"	"graduate_adj-nou"	"She's taught graduate level courses in Mediation, Conflict Resolution, and Family Law."	13	21
"graduate"	"graduate_adj-nou"	"He was awarded the Army Ranger tab and was the class Distinguished Honor Graduate."	73	81
"graduate"	"graduate_adj-nou"	"Graduate students spend a month training in Moscow, while the undergraduates participate in a semester-long program."	0	8
"graduate"	"graduate_adj-nou"	"First Three Graduate Nurses of the Philippines (The News Today) Retrieved December 29, 2015."	12	20
"graduate"	"graduate_adj-nou"	"Xu traveled to the US in 1948, where he attended the graduate school of the Washington University in St. Louis."	53	61
"graduate"	"graduate_adj-nou"	"She is a graduate of the University of Texas, where she received her Master's Degree from the Department of Radio-Television-Film."	9	17
"graduate"	"graduate_adj-nou"	"In 1970 he received a master of arts in teaching,from the Harvard Graduate School of Education."	66	74
"graduate"	"graduate_adj-nou"	"She is also a graduate of Fordham Law School."	14	22
"graduate"	"graduate_adj-nou"	"NIFM provides ICAS officers Post Graduate Diploma in Public Financial Management."	33	41
